Date,Title,Ticker,Article URL
2021-11-19 19:00:00, Neuberger Berman Real Estate Securities Income Fund Announces Amendment To Leverage Facility,,https://www.prnewswire.com/news-releases/neuberger-berman-real-estate-securities-income-fund-announces-amendment-to-leverage-facility-301429436.html
2021-11-19 18:58:00," The Oklahoma-Based Company, Vesta Capital LLC, Enters Kansas Real Estate Market After Purchasing Wichita Property",,https://www.prnewswire.com/news-releases/the-oklahoma-based-company-vesta-capital-llc-enters-kansas-real-estate-market-after-purchasing-wichita-property-301429120.html
2021-11-19 18:56:00," IMPORTANT SHAREHOLDER ALERT- GAOTU TECHEDU INC. (NYSE: GOTU) CLASS ACTION DEADLINE: Bernstein Liebhard LLP Reminds Investors of the Deadline to File a Lead Plaintiff Motion in a Securities Class Action Lawsuit Against Goldman Sachs Group, Inc. and Morgan Stanley for securities law violations regarding trading in Gaotu Techedu, Inc. (NYSE: GOTU) stock.",GOTU,https://www.prnewswire.com/news-releases/important-shareholder-alert--gaotu-techedu-inc-nyse-gotu-class-action-deadline-bernstein-liebhard-llp-reminds-investors-of-the-deadline-to-file-a-lead-plaintiff-motion-in-a-securities-class-action-lawsuit-against-goldman-sach-301429363.html
2021-11-19 18:52:00, Shanghai Futures Exchange und Shanghai International Energy Exchange veröffentlichen monatliche Daten für Oktober 2021,,https://www.prnewswire.com/news-releases/shanghai-futures-exchange-und-shanghai-international-energy-exchange-veroffentlichen-monatliche-daten-fur-oktober-2021-888488028.html
2021-11-19 18:48:00, Shanghai Futures Exchange e Shanghai International Energy Exchange divulgam dados mensais de outubro de 2021,,https://www.prnewswire.com/news-releases/shanghai-futures-exchange-e-shanghai-international-energy-exchange-divulgam-dados-mensais-de-outubro-de-2021-833064556.html
2021-11-19 18:46:00, Shanghai Futures Exchange y Shanghai International Energy Exchange presentan datos mensuales de octubre de 2021,,https://www.prnewswire.com/news-releases/shanghai-futures-exchange-y-shanghai-international-energy-exchange-presentan-datos-mensuales-de-octubre-de-2021-876251751.html
2021-11-19 18:44:00, TerraPay fortalece sua posição nas Américas ao lançar serviços no México e em 15 outros mercados latino-americanos,,https://www.prnewswire.com/news-releases/terrapay-fortalece-sua-posicao-nas-americas-ao-lancar-servicos-no-mexico-e-em-15-outros-mercados-latino-americanos-805240178.html
2021-11-19 18:44:00, Optimum Seismic Challenges Businesses to Help YMCA LA Fight Hunger During Holiday Season,,https://www.prnewswire.com/news-releases/optimum-seismic-challenges-businesses-to-help-ymca-la-fight-hunger-during-holiday-season-301429432.html
2021-11-19 18:44:00, Shanghai Futures Exchange en Shanghai International Energy Exchange publiceren maandcijfers oktober 2021,,https://www.prnewswire.com/news-releases/shanghai-futures-exchange-en-shanghai-international-energy-exchange-publiceren-maandcijfers-oktober-2021-860355293.html
2021-11-19 18:38:00, TerraPay fortalece su posición en las Américas al lanzar servicios en México y otros 15 mercados latinoamericanos,,https://www.prnewswire.com/news-releases/terrapay-fortalece-su-posicion-en-las-americas-al-lanzar-servicios-en-mexico-y-otros-15-mercados-latinoamericanos-803638561.html
2021-11-19 18:37:00," Nostalgic Night For Nashville Native Deana Carter Headlining The Ryman Auditorium To Celebrate The 25th Anniversary Of Her 5X Platinum Debut Album 'Did I Shave My Legs For This?' And Her 2X Platinum CMA Award-Winning Debut Hit Single ""Strawberry Wine""",,https://www.prnewswire.com/news-releases/nostalgic-night-for-nashville-native-deana-carter-headlining-the-ryman-auditorium-to-celebrate-the-25th-anniversary-of-her-5x-platinum-debut-album-did-i-shave-my-legs-for-this-and-her-2x-platinum-cma-award-winning-debut-hit-sin-301429429.html
2021-11-19 18:37:00," Tokopedia „WIB: Indonesia K-Pop Awards"" kündigt Star-Besetzung für erste weltweite Premiere an: BTS, BLACKPINK, TWICE, NCT Dream und viele mehr",,https://www.prnewswire.com/news-releases/tokopedia-wib-indonesia-k-pop-awards-kundigt-star-besetzung-fur-erste-weltweite-premiere-an-bts-blackpink-twice-nct-dream-und-viele-mehr-808847615.html
2021-11-19 18:32:00," Tokopedia annonce la participation de nombreuses stars à la première mondiale de l'événement « WIB : Indonesia K-Pop Awards » : BTS, BLACKPINK, TWICE, NCT Dream et bien d'autres",,https://www.prnewswire.com/news-releases/tokopedia-annonce-la-participation-de-nombreuses-stars-a-la-premiere-mondiale-de-l-evenement-wib-indonesia-k-pop-awards-bts-blackpink-twice-nct-dream-et-bien-d-autres-884128396.html
2021-11-19 18:32:00," Tribunal de Apelaciones de California falla a favor de DAS Corporation, representada por LTL, en una querella internacional que lleva una década",,https://www.prnewswire.com/news-releases/tribunal-de-apelaciones-de-california-falla-a-favor-de-das-corporation-representada-por-ltl-en-una-querella-internacional-que-lleva-una-decada-824925562.html
2021-11-19 18:30:00, IMPORTANT INVESTOR REMINDER: HÖEGH LNG PARTNERS LP (NYSE: HMLP) SHAREHOLDER CLASS ACTION ALERT: Bernstein Liebhard LLP Reminds Investors of the Deadline to File a Lead Plaintiff Motion in a Securities Class Action Lawsuit Against Höegh LNG Partners LP,HMLP,https://www.prnewswire.com/news-releases/important-investor-reminder-hoegh-lng-partners-lp-nyse-hmlp-shareholder-class-action-alert-bernstein-liebhard-llp-reminds-investors-of-the-deadline-to-file-a-lead-plaintiff-motion-in-a-securities-class-action-lawsuit-against--301429350.html
2021-11-19 18:30:00, Industrial Monitoring Relays Market to grow at a CAGR of 6%| Emergence of IoT Based Monitoring Relays acts as Key Driver | 17000+ Technavio Reports,,https://www.prnewswire.com/news-releases/industrial-monitoring-relays-market-to-grow-at-a-cagr-of-6-emergence-of-iot-based-monitoring-relays-acts-as-key-driver--17000-technavio-reports-301428105.html
2021-11-19 18:27:00," Um paraíso de inverno no centro de Nova York: Empire State Building revela decoração natalina, vitrines e eventos especiais",ESRT,https://www.prnewswire.com/news-releases/um-paraiso-de-inverno-no-centro-de-nova-york-empire-state-building-revela-decoracao-natalina-vitrines-e-eventos-especiais-868216036.html
2021-11-19 18:26:00," ProfNet Expert Alerts for November 19, 2021",,https://www.prnewswire.com/news-releases/profnet-expert-alerts-for-november-19-2021-301429420.html
2021-11-19 18:23:00," Ein Winterwunderland im Herzen von NYC: Empire State Building enthüllt Weihnachtsdekorationen, Schaufenster und besondere Veranstaltungen",ESRT,https://www.prnewswire.com/news-releases/ein-winterwunderland-im-herzen-von-nyc-empire-state-building-enthullt-weihnachtsdekorationen-schaufenster-und-besondere-veranstaltungen-813705458.html
2021-11-19 18:22:00," Un país de las maravillas invernal en el corazón de la ciudad de Nueva York: el edificio Empire State revela decoraciones festivas, exhibiciones en las ventanas y eventos especiales",ESRT,https://www.prnewswire.com/news-releases/un-pais-de-las-maravillas-invernal-en-el-corazon-de-la-ciudad-de-nueva-york-el-edificio-empire-state-revela-decoraciones-festivas-exhibiciones-en-las-ventanas-y-eventos-especiales-828681765.html
2021-11-19 18:22:00, Viscosity Announces Acquisition of OraPub.com,,https://www.prnewswire.com/news-releases/viscosity-announces-acquisition-of-orapubcom-301429413.html
2021-11-19 18:18:00, Cushing® MLP & Infrastructure Total Return Fund and Cushing® NextGen Infrastructure Income Fund Announce Trustee Resignation and Trustee Appointment,SRV,https://www.prnewswire.com/news-releases/cushing-mlp--infrastructure-total-return-fund-and-cushing-nextgen-infrastructure-income-fund-announce-trustee-resignation-and-trustee-appointment-301429416.html
2021-11-19 18:18:00," Alpha Latam Management, LLC and Its Debtor Affiliates Receive U.S. Bankruptcy Court Approval of Sale of Colombian Assets to CFG Partners Colombia SAS",,https://www.prnewswire.com/news-releases/alpha-latam-management-llc-and-its-debtor-affiliates-receive-us-bankruptcy-court-approval-of-sale-of-colombian-assets-to-cfg-partners-colombia-sas-301429418.html
2021-11-19 18:15:00, Strados Labs erhält CE-Zeichen für seine RESP™ Smart Sensor Plattform,,https://www.prnewswire.com/news-releases/strados-labs-erhalt-ce-zeichen-fur-seine-resp-tm-smart-sensor-plattform-850215249.html
2021-11-19 18:15:00, Shanghai Electric uzavírá na veletrhu CIIE 2021 dohodu o strategické spolupráci se společností SKF,,https://www.prnewswire.com/news-releases/shanghai-electric-uzavira-na-veletrhu-ciie-2021-dohodu-o-strategicke-spolupraci-se-spolecnosti-skf-892163715.html
2021-11-19 18:11:00, SUPERSOCO voltooit de bouw van haar mondiale hoofdkantoor en onthult zijn strategie voor het sectorplatform,,https://www.prnewswire.com/news-releases/supersoco-voltooit-de-bouw-van-haar-mondiale-hoofdkantoor-en-onthult-zijn-strategie-voor-het-sectorplatform-828224909.html
2021-11-19 18:10:00," Shareholder Alert: Bernstein Litowitz Berger & Grossmann LLP Announces the Filing of a Securities Class Action Lawsuit Against Citrix Systems, Inc.",,https://www.prnewswire.com/news-releases/shareholder-alert-bernstein-litowitz-berger--grossmann-llp-announces-the-filing-of-a-securities-class-action-lawsuit-against-citrix-systems-inc-301429410.html
2021-11-19 18:10:00, SUPERSOCO completa la costruzione della sua sede centrale globale e presenta la sua strategia di piattaforma di settore,,https://www.prnewswire.com/news-releases/supersoco-completa-la-costruzione-della-sua-sede-centrale-globale-e-presenta-la-sua-strategia-di-piattaforma-di-settore-858096551.html
2021-11-19 18:08:00," Atmofizer Technologies Inc. Provides Corporate Update - Harvard, MIT trained Physician Dr. Joshua Helman joins the Board of Directors",,https://www.prnewswire.com/news-releases/atmofizer-technologies-inc-provides-corporate-update--harvard-mit-trained-physician-dr-joshua-helman-joins-the-board-of-directors-301429409.html
2021-11-19 18:07:00, Conagra Brands Issues Voluntary Recall Of Certain Birds Eye Broccoli Tots® Due To Potential Presence Of Small Rocks And Metal Fragments In Product,CAG,https://www.prnewswire.com/news-releases/conagra-brands-issues-voluntary-recall-of-certain-birds-eye-broccoli-tots-due-to-potential-presence-of-small-rocks-and-metal-fragments-in-product-301429408.html
2021-11-19 18:07:00, SUPERSOCO completa la construcción de su sede global,,https://www.prnewswire.com/news-releases/supersoco-completa-la-construccion-de-su-sede-global-800767788.html
2021-11-19 18:06:00, Petco to Present at 1st Annual Needham Virtual Consumer Tech / E-Commerce Conference,WOOF,https://www.prnewswire.com/news-releases/petco-to-present-at-1st-annual-needham-virtual-consumer-tech--e-commerce-conference-301429405.html
2021-11-19 18:06:00, Vision Impact Institute aplaude el plan mundial para la década de acción de la seguridad vial,,https://www.prnewswire.com/news-releases/vision-impact-institute-aplaude-el-plan-mundial-para-la-decada-de-accion-de-la-seguridad-vial-828568940.html
2021-11-19 18:00:00, Urine Collection Devices Market to grow at a CAGR of 5.32% | Increasing Prevalence of CKD acts as Key Driver | 17000+ Technavio Reports,,https://www.prnewswire.com/news-releases/urine-collection-devices-market-to-grow-at-a-cagr-of-5-32--increasing-prevalence-of-ckd-acts-as-key-driver--17000-technavio-reports-301428550.html
2021-11-19 18:00:00, elago Announces Black Friday and Cyber Monday Deals You Don't Want To Miss,,https://www.prnewswire.com/news-releases/elago-announces-black-friday-and-cyber-monday-deals-you-dont-want-to-miss-301429401.html
2021-11-19 17:59:00, InsiteOne LLC launches new platform and partnerships,,https://www.prnewswire.com/news-releases/insiteone-llc-launches-new-platform-and-partnerships-301429400.html
2021-11-19 17:52:00, Barlow Respiratory Hospital Achieves 2021 Re-Certification,,https://www.prnewswire.com/news-releases/barlow-respiratory-hospital-achieves-2021-re-certification-301429397.html
2021-11-19 17:42:00, Lucid Named To Inaugural Inc. Best-Led Companies List,,https://www.prnewswire.com/news-releases/lucid-named-to-inaugural-inc-best-led-companies-list-301429395.html
2021-11-19 17:41:00," Nabors Energy Transition Corp. Announces Closing of $276,000,000 Initial Public Offering, Including Full Exercise of Underwriters' Option to Purchase Additional Units",,https://www.prnewswire.com/news-releases/nabors-energy-transition-corp-announces-closing-of-276-000-000-initial-public-offering-including-full-exercise-of-underwriters-option-to-purchase-additional-units-301429394.html
2021-11-19 17:39:00," Cyber Defense Labs' CEO Robert Anderson Jr, Named Among Top Executives In 2022 Edition Of The Dallas 500",,https://www.prnewswire.com/news-releases/cyber-defense-labs-ceo-robert-anderson-jr-named-among-top-executives-in-2022-edition-of-the-dallas-500-301429392.html
2021-11-19 17:30:00," Agnico Eagle and Kirkland Lake Gold Remind Shareholders to Vote ""For"" their Proposed Merger",AEM,https://www.prnewswire.com/news-releases/agnico-eagle-and-kirkland-lake-gold-remind-shareholders-to-vote-for-their-proposed-merger-301429384.html
2021-11-19 17:30:00, Water Bottles with Filters Market Size to increase by USD 143.78 Mn| Technavio's Research Insights Highlight Increased Adoption of Portable Water Filters During Natural Disasters as Key Driver,,https://www.prnewswire.com/news-releases/water-bottles-with-filters-market-size-to-increase-by-usd-143-78-mn-technavios-research-insights-highlight-increased-adoption-of-portable-water-filters-during-natural-disasters-as-key-driver-301428061.html
