Date,Title,Ticker,Article URL
2021-11-20 00:41:00," SPIRIT OF TEXAS BANCSHARES INVESTOR ALERT BY THE FORMER ATTORNEY GENERAL OF LOUISIANA: Kahn Swick & Foti, LLC Investigates Adequacy of Price and Process in Proposed Sale of Spirit of Texas Bancshares, Inc. - STXB",SFNC,https://www.prnewswire.com/news-releases/spirit-of-texas-bancshares-investor-alert-by-the-former-attorney-general-of-louisiana-kahn-swick--foti-llc-investigates-adequacy-of-price-and-process-in-proposed-sale-of-spirit-of-texas-bancshares-inc---stxb-301429480.html
2021-11-20 00:32:00," ROGERS CORPORATION INVESTOR ALERT BY THE FORMER ATTORNEY GENERAL OF LOUISIANA: Kahn Swick & Foti, LLC Investigates Adequacy of Price and Process in Proposed Sale of Rogers Corporation (NYSE:ROG)",ROG,https://www.prnewswire.com/news-releases/rogers-corporation-investor-alert-by-the-former-attorney-general-of-louisiana-kahn-swick--foti-llc-investigates-adequacy-of-price-and-process-in-proposed-sale-of-rogers-corporation-nyserog-301429472.html
2021-11-20 00:25:00," MOMENTIVE GLOBAL INVESTOR ALERT BY THE FORMER ATTORNEY GENERAL OF LOUISIANA: Kahn Swick & Foti, LLC Investigates Adequacy of Price and Process in Proposed Sale of Momentive Global Inc. - MNTV",ZEN,https://www.prnewswire.com/news-releases/momentive-global-investor-alert-by-the-former-attorney-general-of-louisiana-kahn-swick--foti-llc-investigates-adequacy-of-price-and-process-in-proposed-sale-of-momentive-global-inc---mntv-301429479.html
2021-11-20 00:06:00, This is a test from PR Newswire - F1,,https://www.prnewswire.com/news-releases/this-is-a-test-from-pr-newswire--f1-301429424.html
2021-11-20 00:04:00, This is a test from PR Newswire - H1,,https://www.prnewswire.com/news-releases/this-is-a-test-from-pr-newswire--h1-301429412.html
2021-11-20 00:02:00, This is a test from PR Newswire - T1,,https://www.prnewswire.com/news-releases/this-is-a-test-from-pr-newswire--t1-301429388.html
2021-11-19 23:31:00," The 2021 CCPC annual champion model: Texture and performance coexist, FAW-Volkswagen Audi A3L exceeds your expectations",,https://www.prnewswire.com/news-releases/the-2021-ccpc-annual-champion-model-texture-and-performance-coexist-faw-volkswagen-audi-a3l-exceeds-your-expectations-301429485.html
2021-11-19 23:30:00, Education Consulting Market size to grow by USD 287.08 Mn | Market Research Insights highlight the rising demand for customized learning as key driver | Technavio,,https://www.prnewswire.com/news-releases/education-consulting-market-size-to-grow-by-usd-287-08-mn--market-research-insights-highlight-the-rising-demand-for-customized-learning-as-key-driver--technavio-301428229.html
2021-11-19 23:27:00, Digital Banking Start-up DNBC Launches Mobile Top-up Feature,,https://www.prnewswire.com/news-releases/digital-banking-start-up-dnbc-launches-mobile-top-up-feature-301429484.html
2021-11-19 23:15:00," DICERNA INVESTOR ALERT BY THE FORMER ATTORNEY GENERAL OF LOUISIANA: Kahn Swick & Foti, LLC Investigates Adequacy of Price and Process in Proposed Sale of Dicerna Pharmaceuticals, Inc. - DRNA",NVO,https://www.prnewswire.com/news-releases/dicerna-investor-alert-by-the-former-attorney-general-of-louisiana-kahn-swick--foti-llc-investigates-adequacy-of-price-and-process-in-proposed-sale-of-dicerna-pharmaceuticals-inc---drna-301429473.html
2021-11-19 23:14:00, Who said that the compact car can't pursue speed? This 2021 CCPC annual champion model brings you a different feeling,,https://www.prnewswire.com/news-releases/who-said-that-the-compact-car-cant-pursue-speed-this-2021-ccpc-annual-champion-model-brings-you-a-different-feeling-301429481.html
2021-11-19 22:48:00, CATL et ZF s'associent pour créer un service après-vente optimal dans le domaine de l'e-mobilité et du stockage d'énergie,,https://www.prnewswire.com/news-releases/catl-et-zf-s-associent-pour-creer-un-service-apres-vente-optimal-dans-le-domaine-de-l-e-mobilite-et-du-stockage-d-energie-890304695.html
2021-11-19 22:46:00, SUPERSOCO schließt den Bau seines globalen Hauptsitzes ab und stellt seine Strategie für eine Branchenplattform vor,,https://www.prnewswire.com/news-releases/supersoco-schliesst-den-bau-seines-globalen-hauptsitzes-ab-und-stellt-seine-strategie-fur-eine-branchenplattform-vor-844283570.html
2021-11-19 22:45:00," Bit Digital, Inc. gibt Update der Bitcoin-Produktion und des Mining-Betriebs für das dritte Quartal 2021 bekannt",BTBT,https://www.prnewswire.com/news-releases/bit-digital-inc-gibt-update-der-bitcoin-produktion-und-des-mining-betriebs-fur-das-dritte-quartal-2021-bekannt-870347182.html
2021-11-19 22:43:00," Bit Digital, Inc. annonce une mise à jour relative à la production de bitcoins et aux opérations de minage pour le troisième trimestre de 2021",BTBT,https://www.prnewswire.com/news-releases/bit-digital-inc-annonce-une-mise-a-jour-relative-a-la-production-de-bitcoins-et-aux-operations-de-minage-pour-le-troisieme-trimestre-de-2021-860166018.html
2021-11-19 22:40:00, La manie du monogramme et l'essor de la haute couture technologique : HONOR dévoile les tendances technologiques et de mode à surveiller avec le WGSN,,https://www.prnewswire.com/news-releases/la-manie-du-monogramme-et-l-essor-de-la-haute-couture-technologique-honor-devoile-les-tendances-technologiques-et-de-mode-a-surveiller-avec-le-wgsn-825005164.html
2021-11-19 22:39:00, Vazyme participa da Medica 2021 na Alemanha para acelerar sua expansão no mercado global,,https://www.prnewswire.com/news-releases/vazyme-participa-da-medica-2021-na-alemanha-para-acelerar-sua-expansao-no-mercado-global-821554728.html
2021-11-19 22:33:00, Die Monogramm-Manie und der Aufstieg der Tech-Couture: HONOR stellt mit WGSN die wichtigsten Technologie- und Modetrends vor,,https://www.prnewswire.com/news-releases/die-monogramm-manie-und-der-aufstieg-der-tech-couture-honor-stellt-mit-wgsn-die-wichtigsten-technologie-und-modetrends-vor-852404802.html
2021-11-19 22:30:00," Smoothies Market to Witness USD 7.03 Billion Growth | Barfresh Food Group Inc., Danone SA, Happy Planet Foods Inc., & More Among Top Players | Technavio",,https://www.prnewswire.com/news-releases/smoothies-market-to-witness-usd-7-03-billion-growth--barfresh-food-group-inc-danone-sa-happy-planet-foods-inc--more-among-top-players--technavio-301428552.html
2021-11-19 22:19:00, Vazyme asiste a Medica 2021 en Alemania para acelerar su expansión en el mercado global,,https://www.prnewswire.com/news-releases/vazyme-asiste-a-medica-2021-en-alemania-para-acelerar-su-expansion-en-el-mercado-global-809154179.html
2021-11-19 21:56:00, Shanghai Electric podpísala na veľtrhu CIIE 2021 so spoločnosťou SKF dohodu o strategickej spolupráci,,https://www.prnewswire.com/news-releases/shanghai-electric-podpisala-na-veltrhu-ciie-2021-so-spolocnostou-skf-dohodu-o-strategickej-spolupraci-870796378.html
2021-11-19 21:52:00, Shanghai Electric подписывает Соглашение о стратегическом сотрудничестве с SKF на CIIE 2021,,https://www.prnewswire.com/news-releases/shanghai-electric-podpisyvaet-soglashenie-o-strategicheskom-sotrudnichestve-s-skf-na-ciie-2021-870354314.html
2021-11-19 21:51:00, Vazyme participe au salon Medica 2021 en Allemagne pour accélérer son expansion sur le marché mondial,,https://www.prnewswire.com/news-releases/vazyme-participe-au-salon-medica-2021-en-allemagne-pour-accelerer-son-expansion-sur-le-marche-mondial-879582124.html
2021-11-19 21:47:00," Un décor hivernal féérique au cœur de New York : L'Empire State Building dévoile ses décorations des fêtes, ses vitrines et ses événements spéciaux",ESRT,https://www.prnewswire.com/news-releases/un-decor-hivernal-feerique-au-coeur-de-new-york-l-empire-state-building-devoile-ses-decorations-des-fetes-ses-vitrines-et-ses-evenements-speciaux-884638887.html
2021-11-19 21:44:00," Investor Reminder: Kessler Topaz Meltzer & Check, LLP Reminds Investors of Securities Fraud Class Action Lawsuit Filed Against Novavax, Inc. - NVAX",NVAX,https://www.prnewswire.com/news-releases/investor-reminder-kessler-topaz-meltzer--check-llp-reminds-investors-of-securities-fraud-class-action-lawsuit-filed-against-novavax-inc--nvax-301429419.html
2021-11-19 21:44:00, Sociální obchodní platforma Bingbon dokončila rebranding na BingX,,https://www.prnewswire.com/news-releases/socialni-obchodni-platforma-bingbon-dokoncila-rebranding-na-bingx-827644928.html
2021-11-19 21:42:00, YHLO a dévoilé son nouveau développement de la technologie CLIA au salon MEDICA 2021,,https://www.prnewswire.com/news-releases/yhlo-a-devoile-son-nouveau-developpement-de-la-technologie-clia-au-salon-medica-2021-868436216.html
2021-11-19 21:35:00, Le Shanghai Futures Exchange et le Shanghai International Energy Exchange publient leurs données du mois d'octobre 2021,,https://www.prnewswire.com/news-releases/le-shanghai-futures-exchange-et-le-shanghai-international-energy-exchange-publient-leurs-donnees-du-mois-d-octobre-2021-862710969.html
2021-11-19 21:30:00, Polyurethane Foam Market to grow by USD 1.93 million ton| Rising Demand for PU Foams in China acts as Key Driver | 17000+ Technavio Reports,,https://www.prnewswire.com/news-releases/polyurethane-foam-market-to-grow-by-usd-1-93-million-ton-rising-demand-for-pu-foams-in-china-acts-as-key-driver--17000-technavio-reports-301428195.html
2021-11-19 21:30:00, Sinology Laureate Wang Gungwu Elaborates on the Importance of China's Wen and Shi Tradition,,https://www.prnewswire.com/news-releases/sinology-laureate-wang-gungwu-elaborates-on-the-importance-of-chinas-wen-and-shi-tradition-301428905.html
2021-11-19 21:23:00," Pořad společnosti Tokopedia ‚WIB: Indonesia K-Pop Awards' představuje hvězdné obsazení své první celosvětové premiéry: BTS, BLACKPINK, TWICE, NCT Dream a řada dalších",,https://www.prnewswire.com/news-releases/porad-spolecnosti-tokopedia-wib-indonesia-k-pop-awards-predstavuje-hvezdne-obsazeni-sve-prvni-celosvetove-premiery-bts-blackpink-twice-nct-dream-a-rada-dalsich-800325985.html
2021-11-19 21:22:00," WELLS FARGO INVESTIGATION CONTINUED BY FORMER LOUISIANA ATTORNEY GENERAL: Kahn Swick & Foti, LLC Continues to Investigate the Officers and Directors of Wells Fargo & Company - WFC",WFC,https://www.prnewswire.com/news-releases/wells-fargo-investigation-continued-by-former-louisiana-attorney-general--kahn-swick--foti-llc-continues-to-investigate-the-officers-and-directors-of-wells-fargo--company---wfc-301429453.html
2021-11-19 21:20:00, La presentación global de la marca SALOON - GWM se convierte en el centro de atención del Auto Guangzhou (GIAE) de 2021,,https://www.prnewswire.com/news-releases/la-presentacion-global-de-la-marca-saloon-gwm-se-convierte-en-el-centro-de-atencion-del-auto-guangzhou-giae-de-2021-879155293.html
2021-11-19 21:19:00," ROSEN, A LEADING LAW FIRM, Encourages InnovAge Holding Corp. Investors With Losses Exceeding $100K to Secure Counsel Before Important December 13 Deadline in Securities Class Action - INNV",INNV,https://www.prnewswire.com/news-releases/rosen-a-leading-law-firm-encourages-innovage-holding-corp-investors-with-losses-exceeding-100k-to-secure-counsel-before-important-december-13-deadline-in-securities-class-action--innv-301429404.html
2021-11-19 21:18:00," ROSEN, A TOP RANKED LAW FIRM, Encourages Vipshop Holdings Limited Investors With Losses Over $100K to Secure Counsel Before Important December 13 Deadline in Securities Class Action - VIPS",VIPS,https://www.prnewswire.com/news-releases/rosen-a-top-ranked-law-firm-encourages-vipshop-holdings-limited-investors-with-losses-over-100k-to-secure-counsel-before-important-december-13-deadline-in-securities-class-action--vips-301429403.html
2021-11-19 21:09:00," Witherite Law Group, Fiesta, And Ft. Worth ISD Joined Together To Feed More Than 1,000 Dallas-Ft. Worth Families For Thanksgiving",,https://www.prnewswire.com/news-releases/witherite-law-group-fiesta-and-ft-worth-isd-joined-together-to-feed-more-than-1-000-dallas-ft-worth-families-for-thanksgiving-301429466.html
2021-11-19 21:09:00," SHAREHOLDER ALERT: Monteverde & Associates PC Announces an Investigation of FTS International, Inc. - FTSI",,https://www.prnewswire.com/news-releases/shareholder-alert-monteverde--associates-pc-announces-an-investigation-of-fts-international-inc--ftsi-301429393.html
2021-11-19 21:02:00," Con más de $40,000 en fondos para becas otorgados en 2021, National Latina Business Women Association Inland Empire Institute, en el interior del sur del California, está a punto de transformar la región con programas de asistencia técnica y desarrollo de capacidades.",,https://www.prnewswire.com/news-releases/con-mas-de-40-000-en-fondos-para-becas-otorgados-en-2021-national-latina-business-women-association-inland-empire-institute-en-el-interior-del-sur-del-california-esta-a-punto-de-transformar-la-region-con-programas-de-asistencia-tecnica-y-de-868081546.html
2021-11-19 20:47:00, moomoo Named the Best Active Trading App 2021 by Investing Simple,,https://www.prnewswire.com/news-releases/moomoo-named-the-best-active-trading-app-2021-by-investing-simple-301429463.html
2021-11-19 20:45:00," ROSEN, A HIGHLY RECOGNIZED LAW FIRM, Encourages Meta Platforms, Inc. f/k/a Facebook, Inc. Investors with Losses in Excess of $100K to Secure Counsel Before Important Deadline in Securities Class Action Commenced by the Firm - FB",FB,https://www.prnewswire.com/news-releases/rosen-a-highly-recognized-law-firm-encourages-meta-platforms-inc-fka-facebook-inc-investors-with-losses-in-excess-of-100k-to-secure-counsel-before-important-deadline-in-securities-class-action-commenced-by-the-firm--fb-301429390.html
2021-11-19 20:41:00, Presentación mundial de la marca SALOON de GWM,,https://www.prnewswire.com/news-releases/presentacion-mundial-de-la-marca-saloon-de-gwm-888079913.html
2021-11-19 20:40:00, THAIGROOVE présente 50 marques thaïlandaises respectueuses de l'environnement lors de la Journée verte pour aider à changer le monde,,https://www.prnewswire.com/news-releases/thaigroove-presente-50-marques-thailandaises-respectueuses-de-l-environnement-lors-de-la-journee-verte-pour-aider-a-changer-le-monde-879948144.html
2021-11-19 20:35:00," THAIGROOVE präsentiert 50 umweltfreundliche thailändische Marken beim Green Day und hilft dabei, die Welt zu verändern",,https://www.prnewswire.com/news-releases/thaigroove-prasentiert-50-umweltfreundliche-thailandische-marken-beim-green-day-und-hilft-dabei-die-welt-zu-verandern-893434340.html
2021-11-19 20:34:00, President Biden Pardons National Thanksgiving Turkey,,https://www.prnewswire.com/news-releases/president-biden-pardons-national-thanksgiving-turkey-301429462.html
2021-11-19 20:30:00, Municipal Solid Waste Management Market to grow by USD 34.04 billion| Increase in the Urban Population acts as Key Driver | 17000+ Technavio Reports,,https://www.prnewswire.com/news-releases/municipal-solid-waste-management-market-to-grow-by-usd-34-04-billion-increase-in-the-urban-population-acts-as-key-driver--17000-technavio-reports-301428194.html
2021-11-19 20:30:00, CATL e ZF unem forças para um serviço ideal de pós-venda em e-Mobility e armazenamento de energia,,https://www.prnewswire.com/news-releases/catl-e-zf-unem-forcas-para-um-servico-ideal-de-pos-venda-em-e-mobility-e-armazenamento-de-energia-834222467.html
2021-11-19 20:27:00, SHAREHOLDER ALERT: Monteverde & Associates PC Announces an Investigation of CoreSite Realty Corp. - COR,,https://www.prnewswire.com/news-releases/shareholder-alert-monteverde--associates-pc-announces-an-investigation-of-coresite-realty-corp--cor-301429378.html
2021-11-19 20:22:00," Kessler Topaz Meltzer & Check, LLP Announces a Securities Fraud Class Action Lawsuit Filed Against Eargo, Inc. (EAR) and Encourages Investors with Significant Losses to Contact the Firm",EAR,https://www.prnewswire.com/news-releases/kessler-topaz-meltzer--check-llp-announces-a-securities-fraud-class-action-lawsuit-filed-against-eargo-inc-ear-and-encourages-investors-with-significant-losses-to-contact-the-firm-301429396.html
2021-11-19 20:20:00," PTE FINAL DEADLINE TUESDAY: ROSEN, A GLOBAL AND LEADING LAW FIRM, Encourages PolarityTE, Inc. Investors to Secure Counsel Before Important November 23 Deadline in Securities Class Action - PTE",PTE,https://www.prnewswire.com/news-releases/pte-final-deadline-tuesday-rosen-a-global-and-leading-law-firm-encourages-polarityte-inc-investors-to-secure-counsel-before-important-november-23-deadline-in-securities-class-action--pte-301429383.html
2021-11-19 20:19:00, SHAREHOLDER ALERT: Monteverde & Associates PC Announces an Investigation of NeoPhotonics Corp. - NPTN,,https://www.prnewswire.com/news-releases/shareholder-alert-monteverde--associates-pc-announces-an-investigation-of-neophotonics-corp--nptn-301429372.html
2021-11-19 20:18:00, CATL y ZF unen fuerzas para brindar un servicio de posventa óptimo en movilidad eléctrica y almacenamiento de energía,,https://www.prnewswire.com/news-releases/catl-y-zf-unen-fuerzas-para-brindar-un-servicio-de-posventa-optimo-en-movilidad-electrica-y-almacenamiento-de-energia-898688962.html
2021-11-19 20:14:00, La National Hispanic Health Foundation (NHHF) homenajea a líderes y estudiantes que promueven la salud latina,,https://www.prnewswire.com/news-releases/la-national-hispanic-health-foundation-nhhf-homenajea-a-lideres-y-estudiantes-que-promueven-la-salud-latina-876789694.html
2021-11-19 20:08:00," SHAREHOLDER ALERT: Monteverde & Associates PC Announces an Investigation of Level One Bancorp, Inc. - LEVL",,https://www.prnewswire.com/news-releases/shareholder-alert-monteverde--associates-pc-announces-an-investigation-of-level-one-bancorp-inc--levl-301429369.html
2021-11-19 20:08:00," Solis Health planea ofrecer el beneficio ""Family On-Demand"" de Papa Pals para los miembros con necesidades especiales en 2022",,https://www.prnewswire.com/news-releases/solis-health-planea-ofrecer-el-beneficio-family-on-demand-de-papa-pals-para-los-miembros-con-necesidades-especiales-en-2022-882510156.html
2021-11-19 20:05:00, ZF y CATL unen fuerzas para brindar un servicio de posventa óptimo en movilidad eléctrica y almacenamiento de energía,,https://www.prnewswire.com/news-releases/zf-y-catl-unen-fuerzas-para-brindar-un-servicio-de-posventa-optimo-en-movilidad-electrica-y-almacenamiento-de-energia-885126403.html
2021-11-19 20:00:00, Pancake Mixed Market to grow by USD 152.44 billion| Increasing Influence of Food Channels and Shows on TV to Prepare Pancakes at Home acts as Key Driver | 17000+ Technavio Reports,,https://www.prnewswire.com/news-releases/pancake-mixed-market-to-grow-by-usd-152-44-billion-increasing-influence-of-food-channels-and-shows-on-tv-to-prepare-pancakes-at-home-acts-as-key-driver--17000-technavio-reports-301428166.html
2021-11-19 20:00:00," If you made a point-of-sale purchase at a Forever 21 store using a credit, debit, or other payment card, you may be eligible for a payment from a class action settlement",,https://www.prnewswire.com/news-releases/if-you-made-a-point-of-sale-purchase-at-a-forever-21-store-using-a-credit-debit-or-other-payment-card-you-may-be-eligible-for-a-payment-from-a-class-action-settlement-301428385.html
2021-11-19 19:56:00," SHAREHOLDER ALERT: Monteverde & Associates PC Announces an Investigation of Viasat, Inc. - VSAT",,https://www.prnewswire.com/news-releases/shareholder-alert-monteverde--associates-pc-announces-an-investigation-of-viasat-inc--vsat-301429367.html
2021-11-19 19:49:00," „Route to the Top""-Bericht 2021 von Heidrick & Struggles: CEO-Ernennungen erreichen Rekordwerte und übertreffen Höchstwerte vor den Pandemie",HSII,https://www.prnewswire.com/news-releases/-route-to-the-top-bericht-2021-von-heidrick-amp-struggles-ceo-ernennungen-erreichen-rekordwerte-und-ubertreffen-hochstwerte-vor-den-pandemie-801647945.html
2021-11-19 19:48:00, Vision Impact Institute begrüßt den neuen Globalen Plan der Aktionsdekade für Straßenverkehrssicherheit,,https://www.prnewswire.com/news-releases/vision-impact-institute-begrusst-den-neuen-globalen-plan-der-aktionsdekade-fur-strassenverkehrssicherheit-866388547.html
2021-11-19 19:41:00, SHAREHOLDER ALERT: Monteverde & Associates PC Announces an Investigation of McAfee Corp. - MCFE,,https://www.prnewswire.com/news-releases/shareholder-alert-monteverde--associates-pc-announces-an-investigation-of-mcafee-corp--mcfe-301429365.html
2021-11-19 19:39:00, Vision Impact Institute aplaude novo Plano Global para a Década de Ação pela Segurança Viária,,https://www.prnewswire.com/news-releases/vision-impact-institute-aplaude-novo-plano-global-para-a-decada-de-acao-pela-seguranca-viaria-883569829.html
2021-11-19 19:34:00, INVESTOR REMINDER: BIOMARIN PHARMACEUTICAL INC. (NASDAQ: BMRN) SHAREHOLDER CLASS ACTION DEADLINE- Bernstein Liebhard LLP Reminds Investors of the Deadline to File a Lead Plaintiff Motion in a Securities Class Action Lawsuit Against BioMarin Pharmaceutical Inc.,BMRN,https://www.prnewswire.com/news-releases/investor-reminder-biomarin-pharmaceutical-inc-nasdaq-bmrn-shareholder-class-action-deadline--bernstein-liebhard-llp-reminds-investors-of-the-deadline-to-file-a-lead-plaintiff-motion-in-a-securities-class-action-lawsuit-agains-301429355.html
2021-11-19 19:33:00, Endeavor Bank Announces 2021 Third Quarter Financial Results,,https://www.prnewswire.com/news-releases/endeavor-bank-announces-2021-third-quarter-financial-results-301429451.html
2021-11-19 19:32:00, Vision Impact Institute aplaude el nuevo Plan mundial para el decenio de acción para la seguridad vial,,https://www.prnewswire.com/news-releases/vision-impact-institute-aplaude-el-nuevo-plan-mundial-para-el-decenio-de-accion-para-la-seguridad-vial-861287073.html
2021-11-19 19:30:00, UHD TV Market to grow by USD 256.14 billion| Reduction in ASP of UHD TVs acts as Key Driver | 17000+ Technavio Reports,,https://www.prnewswire.com/news-releases/uhd-tv-market-to-grow-by-usd-256-14-billion-reduction-in-asp-of-uhd-tvs-acts-as-key-driver--17000-technavio-reports-301428150.html
2021-11-19 19:25:00, Benchling annonce un financement de série F de 100 millions de dollars et la poursuite de son expansion européenne,,https://www.prnewswire.com/news-releases/benchling-annonce-un-financement-de-serie-f-de-100-millions-de-dollars-et-la-poursuite-de-son-expansion-europeenne-835120870.html
2021-11-19 19:25:00, CATL y ZF se unen para un servicio posventa óptimo en movilidad eléctrica y almacenamiento de energía,,https://www.prnewswire.com/news-releases/catl-y-zf-se-unen-para-un-servicio-posventa-optimo-en-movilidad-electrica-y-almacenamiento-de-energia-829593277.html
2021-11-19 19:23:00," SHAREHOLDER ALERT: WeissLaw LLP Investigates Spirit of Texas Bancshares, Inc.",STXB,https://www.prnewswire.com/news-releases/shareholder-alert-weisslaw-llp-investigates-spirit-of-texas-bancshares-inc-301429366.html
2021-11-19 19:22:00, HONOR desvela las tendencias tecnológicas y de moda a seguir con WGSN,,https://www.prnewswire.com/news-releases/honor-desvela-las-tendencias-tecnologicas-y-de-moda-a-seguir-con-wgsn-860876571.html
2021-11-19 19:19:00, La cooperación financiera China-Singapur comparte beneficios con el mundo,,https://www.prnewswire.com/news-releases/la-cooperacion-financiera-china-singapur-comparte-beneficios-con-el-mundo-812436822.html
2021-11-19 19:18:00, Finanzielle Zusammenarbeit zwischen China und Singapur bringt Vorteile für die ganze Welt,,https://www.prnewswire.com/news-releases/finanzielle-zusammenarbeit-zwischen-china-und-singapur-bringt-vorteile-fur-die-ganze-welt-897423821.html
2021-11-19 19:17:00, La cooperación financiera entre China y Singapur comparte beneficios con el mundo,,https://www.prnewswire.com/news-releases/la-cooperacion-financiera-entre-china-y-singapur-comparte-beneficios-con-el-mundo-842499912.html
2021-11-19 19:10:00, THAIGROOVE presenta 50 marcas tailandesas respetuosas con el medio ambiente en el Día Verde,,https://www.prnewswire.com/news-releases/thaigroove-presenta-50-marcas-tailandesas-respetuosas-con-el-medio-ambiente-en-el-dia-verde-895160739.html
2021-11-19 19:10:00," Vazyme nimmt an der Medica 2021 in Deutschland teil, um seine globale Marktexpansion auszubauen",,https://www.prnewswire.com/news-releases/vazyme-nimmt-an-der-medica-2021-in-deutschland-teil-um-seine-globale-marktexpansion-auszubauen-875086334.html
2021-11-19 19:00:00," If you used the Zoom Meetings Application between March 30, 2016 and July 30, 2021, you could be entitled to benefits, including a cash payment, under a class action settlement",,https://www.prnewswire.com/news-releases/if-you-used-the-zoom-meetings-application-between-march-30-2016-and-july-30-2021-you-could-be-entitled-to-benefits-including-a-cash-payment-under-a-class-action-settlement-301429241.html
2021-11-19 19:00:00, Camel Milk Market to grow by USD 4.24 billion| Increasing Camel Milk Production acts as Key Driver | 17000+ Technavio Reports,,https://www.prnewswire.com/news-releases/camel-milk-market-to-grow-by-usd-4-24-billion-increasing-camel-milk-production-acts-as-key-driver--17000-technavio-reports-301428153.html
2021-11-19 19:00:00, Neuberger Berman MLP And Energy Income Fund Announces Amendment To Leverage Facility,,https://www.prnewswire.com/news-releases/neuberger-berman-mlp-and-energy-income-fund-announces-amendment-to-leverage-facility-301429438.html
2021-11-19 19:00:00, SHAREHOLDER ALERT: Monteverde & Associates PC Announces an Investigation of CorePoint Lodging Inc. - CPLG,,https://www.prnewswire.com/news-releases/shareholder-alert-monteverde--associates-pc-announces-an-investigation-of-corepoint-lodging-inc--cplg-301429347.html
